{
  "contract_version": "0.1.0",
  "contract_status": "placeholder_v0",
  "metadata_only": true,
  "read_only": true,
  "contract_id": "sample-contract-canvas-package-placeholder-001",
  "contract_type": "canvas_export_package_contract",
  "title": "Canvas Export Package Contract Placeholder",
  "placeholder_status": "planning_only",
  "registry_references": [],
  "local_first_safety_flags": [
    "metadata_only",
    "no_student_data",
    "not_generated",
    "not_rendered",
    "manual_entry",
    "placeholder_only",
    "no_external_resolution",
    "contract_v0_placeholder"
  ],
  "planning_notes": "Canvas export package contract placeholder only; no Canvas API or package building in v0",
  "created_by_manual_entry": true,
  "activation_status": "contract_v0_placeholder"
}
